<?xml version="1.0" encoding="UTF-8"?>
<xs:schema xmlns:xs="http://www.w3.org/2001/XMLSchema" elementFormDefault="qualified" attributeFormDefault="unqualified">
	<xs:element name="MeetupInfo">
		<xs:complexType>
			<xs:sequence>
				<xs:element name="Date" type="xs:dateTime"/>
				<xs:element name="Speakers">
					<xs:complexType>
						<xs:sequence maxOccurs="unbounded">
							<xs:element name="SpeakerInfo">
								<xs:complexType>
									<xs:sequence>
										<xs:element name="Name" type="xs:string"/>
										<xs:element name="Mail" type="xs:string"/>
										<xs:element name="Approved" type="xs:boolean"/>
									</xs:sequence>
								</xs:complexType>
							</xs:element>
						</xs:sequence>
					</xs:complexType>
				</xs:element>
			</xs:sequence>
		</xs:complexType>
	</xs:element>
</xs:schema>
