<?xml version="1.0" encoding="UTF-8"?>
<MeetupInfo xsi:noNamespaceSchemaLocation="MeetupInfo.xsd" xmlns:xsi="http://www.w3.org/2001/XMLSchema-instance">
	<Date>2017-04-13T16:00:00Z</Date>
	<Speakers>
		<SpeakerInfo>
			<Name>Igor Labutin</Name>
			<Mail>ilabutin@gmail.com</Mail>
			<Approved>true</Approved>
		</SpeakerInfo>
		<SpeakerInfo>
			<Name>Jon Skeet</Name>
			<Mail>skeet@pobox.com</Mail>
			<Approved>false</Approved>
		</SpeakerInfo>
	</Speakers>
</MeetupInfo>
